{"$schema":"http://json-schema.org/draft-07/schema#","additionalProperties":false,"allOf":[{"if":{"properties":{"operating_mode":{"const":"minimal-safe-ci"}}},"then":{"not":{"anyOf":[{"required":["deep_audit"]},{"required":["staged_upgrade"]}]},"required":["minimal_gate_plan"]}},{"if":{"properties":{"operating_mode":{"const":"deep-repository-upgrade"}}},"then":{"not":{"required":["minimal_gate_plan"]},"required":["deep_audit","staged_upgrade"]}}],"definitions":{"capability":{"additionalProperties":false,"properties":{"capability_id":{"pattern":"^[a-z0-9]+(?:_[a-z0-9]+)*$","type":"string"},"evidence":{"$ref":"#/definitions/evidence"},"repair_hint":{"minLength":1,"type":"string"},"state":{"enum":["absent","nominal","partial","operational","operational_but_weak","unknown","not_applicable"]}},"required":["capability_id","state","evidence"],"type":"object"},"channels":{"additionalProperties":false,"properties":{"baseline_capabilities":{"$ref":"#/definitions/recommendations"},"observed_failures":{"$ref":"#/definitions/recommendations"},"ranked":{"$ref":"#/definitions/recommendations"},"structural_invariants":{"$ref":"#/definitions/recommendations"}},"required":["observed_failures","structural_invariants","baseline_capabilities","ranked"],"type":"object"},"coldStart":{"additionalProperties":false,"properties":{"confidence_adjustment":{"type":"string"},"not_yet_observed_is_not_not_needed":{"const":true},"status":{"enum":["limited_history","cold_start","no_recorded_failures","history_informative"]}},"required":["status","confidence_adjustment","not_yet_observed_is_not_not_needed"],"type":"object"},"component":{"additionalProperties":false,"properties":{"component_id":{"type":"string"},"evidence":{"$ref":"#/definitions/evidence"},"manifests":{"$ref":"#/definitions/strings"},"root":{"type":"string"},"tests":{"$ref":"#/definitions/strings"}},"required":["component_id","root","manifests","tests","evidence"],"type":"object"},"deepAudit":{"additionalProperties":false,"properties":{"current_ci_cannot_detect":{"type":"array"},"decision_rationale":{"type":"string"},"executable_architecture":{"type":"object"},"high_risk_without_oracle":{"type":"array"},"nominal_capabilities":{"items":{"$ref":"#/definitions/capability"},"type":"array"},"principal_contracts":{"type":"array"},"silent_or_late_failures":{"type":"array"},"testability_first":{"type":"boolean"}},"required":["executable_architecture","principal_contracts","silent_or_late_failures","high_risk_without_oracle","nominal_capabilities","current_ci_cannot_detect","testability_first","decision_rationale"],"type":"object"},"diagnostic":{"additionalProperties":false,"properties":{"affected_area":{"minLength":1,"type":"string"},"code":{"pattern":"^[A-Z][A-Z0-9_]*$","type":"string"},"evidence_references":{"$ref":"#/definitions/strings"},"message":{"minLength":1,"type":"string"},"repair_hint":{"minLength":1,"type":"string"},"severity":{"enum":["info","warning","error"]}},"required":["code","severity","message","affected_area","evidence_references","repair_hint"],"type":"object"},"evidence":{"additionalProperties":false,"properties":{"confidence":{"enum":["low","medium","high"]},"rationale":{"minLength":1,"type":"string"},"references":{"$ref":"#/definitions/strings"},"state":{"enum":["observed","derived","inferred","unavailable","not_applicable"]}},"required":["state","references","rationale"],"type":"object"},"history":{"properties":{"co_change_pairs":{"type":"array"},"commit_count_analyzed":{"minimum":0,"type":"integer"},"commit_limit":{"minimum":0,"type":"integer"},"diagnostics":{"items":{"$ref":"#/definitions/diagnostic"},"type":"array"},"evidence":{"$ref":"#/definitions/evidence"},"production_without_test_changes":{"type":"array"},"repeated_fix_subsystems":{"type":"array"},"revert_chains":{"type":"array"},"status":{"enum":["collected","unavailable","not_collected"]},"workflow_config_churn":{"type":"array"}},"required":["status","commit_limit","revert_chains","co_change_pairs","production_without_test_changes","workflow_config_churn","repeated_fix_subsystems","diagnostics"],"type":"object"},"minimalPlan":{"additionalProperties":false,"properties":{"constraint":{"type":"string"},"deferred":{"$ref":"#/definitions/recommendations"},"phase_1":{"$ref":"#/definitions/recommendations"}},"required":["phase_1","deferred","constraint"],"type":"object"},"modePolicy":{"additionalProperties":false,"properties":{"collect_history_structure":{"type":"boolean"},"collect_remote_telemetry":{"type":"boolean"},"include_baseline_capabilities":{"type":"boolean"},"include_testability_gaps":{"type":"boolean"},"max_phase_1_items":{"minimum":1,"type":"integer"},"recommendation_scope":{"minLength":1,"type":"string"}},"required":["collect_history_structure","collect_remote_telemetry","include_baseline_capabilities","include_testability_gaps","recommendation_scope","max_phase_1_items"],"type":"object"},"profileComposition":{"additionalProperties":false,"properties":{"candidate_checks":{"$ref":"#/definitions/strings"},"common_failure_modes":{"$ref":"#/definitions/strings"},"cost_noise_notes":{"$ref":"#/definitions/strings"},"exclusions":{"$ref":"#/definitions/strings"},"expected_capabilities":{"$ref":"#/definitions/strings"},"profile_contract_version":{"const":"1.0.0"},"selected_profiles":{"$ref":"#/definitions/strings"},"structural_invariants":{"$ref":"#/definitions/strings"}},"required":["profile_contract_version","selected_profiles","expected_capabilities","structural_invariants","common_failure_modes","candidate_checks","exclusions","cost_noise_notes"],"type":"object"},"profileMatch":{"additionalProperties":false,"properties":{"category":{"type":"string"},"evidence":{"$ref":"#/definitions/evidence"},"profile_id":{"type":"string"}},"required":["profile_id","category","evidence"],"type":"object"},"profiles":{"additionalProperties":false,"properties":{"composition":{"$ref":"#/definitions/profileComposition"},"matches":{"items":{"$ref":"#/definitions/profileMatch"},"type":"array"}},"required":["matches","composition"],"type":"object"},"rankingFactors":{"additionalProperties":false,"properties":{"control_overlap":{"maximum":3,"minimum":0,"type":"integer"},"evidence_strength":{"maximum":3,"minimum":0,"type":"integer"},"execution_time":{"maximum":3,"minimum":0,"type":"integer"},"implementation_complexity":{"maximum":3,"minimum":0,"type":"integer"},"invariant_criticality":{"maximum":3,"minimum":0,"type":"integer"},"maintainability":{"maximum":3,"minimum":0,"type":"integer"},"maintenance_cost":{"maximum":3,"minimum":0,"type":"integer"},"noise_risk":{"maximum":3,"minimum":0,"type":"integer"},"regression_detection":{"maximum":3,"minimum":0,"type":"integer"},"reversibility":{"maximum":3,"minimum":0,"type":"integer"},"risk_reduction":{"maximum":3,"minimum":0,"type":"integer"},"silent_failure_exposure":{"maximum":3,"minimum":0,"type":"integer"}},"required":["risk_reduction","invariant_criticality","regression_detection","silent_failure_exposure","evidence_strength","maintainability","reversibility","implementation_complexity","execution_time","noise_risk","maintenance_cost","control_overlap"],"type":"object"},"recommendation":{"additionalProperties":false,"properties":{"affected_capability":{"type":["string","null"]},"decision":{"enum":["phase_1","phase_2","deferred","rejected"]},"diagnostic":{"$ref":"#/definitions/diagnostic"},"evidence":{"additionalProperties":false,"properties":{"basis":{"type":"string"},"confidence":{"enum":["low","medium","high"]},"references":{"$ref":"#/definitions/strings"}},"required":["references","basis","confidence"],"type":"object"},"implementation":{"$ref":"#/definitions/strings"},"protected_invariant":{"type":"string"},"ranking":{"additionalProperties":false,"properties":{"factors":{"$ref":"#/definitions/rankingFactors"},"model_version":{"const":"1.0.0"},"ordinal_total":{"type":"integer"},"priority_band":{"enum":["high","medium","low","defer"]}},"required":["model_version","factors","ordinal_total","priority_band"],"type":"object"},"recommendation_id":{"type":"string"},"source":{"enum":["observed_failure","structural_invariant","baseline_capability"]},"title":{"type":"string"}},"required":["recommendation_id","source","title","affected_capability","protected_invariant","evidence","ranking","implementation","decision","diagnostic"],"type":"object"},"recommendations":{"items":{"$ref":"#/definitions/recommendation"},"type":"array"},"repositoryModel":{"additionalProperties":false,"properties":{"build_systems":{"$ref":"#/definitions/strings"},"capabilities":{"items":{"$ref":"#/definitions/capability"},"type":"array"},"components":{"items":{"$ref":"#/definitions/component"},"type":"array"},"config_files":{"$ref":"#/definitions/strings"},"critical_execution_paths":{"$ref":"#/definitions/strings"},"entry_points":{"items":{"type":"object"},"type":"array"},"examples":{"$ref":"#/definitions/strings"},"file_count":{"minimum":0,"type":"integer"},"frameworks":{"$ref":"#/definitions/strings"},"generated_artifacts":{"$ref":"#/definitions/strings"},"languages":{"$ref":"#/definitions/strings"},"lockfiles":{"$ref":"#/definitions/strings"},"manifests":{"items":{"type":"object"},"type":"array"},"model_evidence":{"$ref":"#/definitions/evidence"},"model_version":{"const":"1.0.0"},"relationships":{"items":{"type":"object"},"type":"array"},"release_paths":{"$ref":"#/definitions/strings"},"repository_archetypes":{"$ref":"#/definitions/strings"},"root":{"type":"string"},"schemas":{"$ref":"#/definitions/strings"},"test_suites":{"type":"object"},"unresolved_evidence":{"items":{"$ref":"#/definitions/diagnostic"},"type":"array"},"validators":{"$ref":"#/definitions/strings"},"workflows":{"items":{"type":"object"},"type":"array"}},"required":["model_version","root","file_count","repository_archetypes","components","languages","frameworks","build_systems","manifests","lockfiles","config_files","entry_points","test_suites","validators","schemas","examples","generated_artifacts","release_paths","workflows","critical_execution_paths","relationships","capabilities","unresolved_evidence","model_evidence"],"type":"object"},"stagedUpgrade":{"additionalProperties":false,"properties":{"baseline_capability_gaps":{"$ref":"#/definitions/recommendations"},"ci_blind_spots":{"type":"array"},"critical_unprotected_invariants":{"type":"array"},"current_engineering_baseline":{"type":"object"},"intentionally_uncovered":{"type":"array"},"observed_failures":{"$ref":"#/definitions/recommendations"},"phase_1":{"$ref":"#/definitions/recommendations"},"phase_2":{"$ref":"#/definitions/recommendations"},"ranked_high_leverage_improvements":{"$ref":"#/definitions/recommendations"},"repository_model_summary":{"type":"object"},"structural_invariants":{"$ref":"#/definitions/recommendations"},"testability_gaps":{"type":"array"},"unresolved_evidence_limitations":{"items":{"$ref":"#/definitions/diagnostic"},"type":"array"},"validation_and_measurement_plan":{"$ref":"#/definitions/strings"}},"required":["current_engineering_baseline","repository_model_summary","critical_unprotected_invariants","observed_failures","structural_invariants","baseline_capability_gaps","testability_gaps","ci_blind_spots","ranked_high_leverage_improvements","phase_1","phase_2","intentionally_uncovered","unresolved_evidence_limitations","validation_and_measurement_plan"],"type":"object"},"strings":{"items":{"type":"string"},"type":"array","uniqueItems":true},"telemetry":{"additionalProperties":false,"properties":{"average_duration_seconds":{"minimum":0,"type":["integer","null"]},"covered_branches":{"$ref":"#/definitions/strings"},"covered_events":{"$ref":"#/definitions/strings"},"diagnostics":{"items":{"$ref":"#/definitions/diagnostic"},"type":"array"},"evidence":{"$ref":"#/definitions/evidence"},"recurring_failures":{"type":"array"},"runs":{"type":"array"},"status":{"enum":["collected","unavailable"]}},"required":["status","runs","recurring_failures","average_duration_seconds","covered_branches","covered_events","evidence","diagnostics"],"type":"object"}},"properties":{"canonicalization_version":{"const":"1"},"cold_start":{"$ref":"#/definitions/coldStart"},"deep_audit":{"$ref":"#/definitions/deepAudit"},"diagnostics":{"items":{"$ref":"#/definitions/diagnostic"},"type":"array"},"evidence_sha256":{"pattern":"^[0-9a-f]{64}$","type":"string"},"generated_at":{"pattern":"^[0-9]{4}-[0-9]{2}-[0-9]{2}T[0-9]{2}:[0-9]{2}:[0-9]{2}Z$","type":"string"},"history_analysis":{"$ref":"#/definitions/history"},"minimal_gate_plan":{"$ref":"#/definitions/minimalPlan"},"mode_policy":{"$ref":"#/definitions/modePolicy"},"operating_mode":{"enum":["minimal-safe-ci","deep-repository-upgrade"]},"profiles":{"$ref":"#/definitions/profiles"},"recommendations":{"$ref":"#/definitions/channels"},"report_version":{"const":"1.0.0"},"repository":{"minLength":1,"type":"string"},"repository_model":{"$ref":"#/definitions/repositoryModel"},"staged_upgrade":{"$ref":"#/definitions/stagedUpgrade"},"workflow_telemetry":{"$ref":"#/definitions/telemetry"}},"required":["report_version","canonicalization_version","generated_at","evidence_sha256","repository","operating_mode","mode_policy","repository_model","profiles","history_analysis","workflow_telemetry","cold_start","recommendations","diagnostics"],"title":"Repository Upgrade Report v1","type":"object"}
