{"canonicalization_version":"1","cold_start":{"confidence_adjustment":"No repository history is embedded in the static contract example.","not_yet_observed_is_not_not_needed":true,"status":"limited_history"},"deep_audit":{"current_ci_cannot_detect":[],"decision_rationale":"Static contract example; no repository decision is asserted.","executable_architecture":{},"high_risk_without_oracle":[],"nominal_capabilities":[],"principal_contracts":[],"silent_or_late_failures":[],"testability_first":false},"diagnostics":[{"affected_area":"example","code":"EXAMPLE_EVIDENCE_ONLY","evidence_references":[],"message":"This static artifact demonstrates the contract shape.","repair_hint":"Run tools/repository_upgrade.py against a real repository for project evidence.","severity":"info"}],"evidence_sha256":"07b83660d3be685d616d17e3b6b796b6278658849bb6257b4746a6e2fb30b894","generated_at":"2026-07-10T00:00:00Z","history_analysis":{"co_change_pairs":[],"commit_limit":0,"diagnostics":[],"production_without_test_changes":[],"repeated_fix_subsystems":[],"revert_chains":[],"status":"not_collected","workflow_config_churn":[]},"mode_policy":{"collect_history_structure":true,"collect_remote_telemetry":true,"include_baseline_capabilities":true,"include_testability_gaps":true,"max_phase_1_items":5,"recommendation_scope":"repository_code_tests_validators_and_ci"},"operating_mode":"deep-repository-upgrade","profiles":{"composition":{"candidate_checks":[],"common_failure_modes":[],"cost_noise_notes":[],"exclusions":[],"expected_capabilities":[],"profile_contract_version":"1.0.0","selected_profiles":[],"structural_invariants":[]},"matches":[]},"recommendations":{"baseline_capabilities":[],"observed_failures":[],"ranked":[],"structural_invariants":[]},"report_version":"1.0.0","repository":"example/contract-shape","repository_model":{"build_systems":[],"capabilities":[],"components":[],"config_files":[],"critical_execution_paths":[],"entry_points":[],"examples":[],"file_count":0,"frameworks":[],"generated_artifacts":[],"languages":[],"lockfiles":[],"manifests":[],"model_evidence":{"confidence":"low","rationale":"Contract example with no project-specific claim.","references":[],"state":"derived"},"model_version":"1.0.0","relationships":[],"release_paths":[],"repository_archetypes":[],"root":".","schemas":[],"test_suites":{"commands_observed_in_ci":[],"files":[],"negative_files":[]},"unresolved_evidence":[],"validators":[],"workflows":[]},"staged_upgrade":{"baseline_capability_gaps":[],"ci_blind_spots":[],"critical_unprotected_invariants":[],"current_engineering_baseline":{},"intentionally_uncovered":[],"observed_failures":[],"phase_1":[],"phase_2":[],"ranked_high_leverage_improvements":[],"repository_model_summary":{},"structural_invariants":[],"testability_gaps":[],"unresolved_evidence_limitations":[],"validation_and_measurement_plan":[]},"workflow_telemetry":{"average_duration_seconds":null,"covered_branches":[],"covered_events":[],"diagnostics":[],"evidence":{"rationale":"No workflow telemetry is embedded in the static example.","references":[],"state":"unavailable"},"recurring_failures":[],"runs":[],"status":"unavailable"}}
