{"canonicalization_version":"1","cold_start":{"confidence_adjustment":"No repository history is embedded in the static contract example.","not_yet_observed_is_not_not_needed":true,"status":"limited_history"},"diagnostics":[{"affected_area":"example","code":"EXAMPLE_EVIDENCE_ONLY","evidence_references":[],"message":"This static artifact demonstrates the contract shape.","repair_hint":"Run tools/repository_upgrade.py against a real repository for project evidence.","severity":"info"}],"evidence_sha256":"2944188742fa646f234b229d0715ea3570b85336c13a39a5bb2efec4310078d3","generated_at":"2026-07-10T00:00:00Z","history_analysis":{"co_change_pairs":[],"commit_limit":0,"diagnostics":[],"production_without_test_changes":[],"repeated_fix_subsystems":[],"revert_chains":[],"status":"not_collected","workflow_config_churn":[]},"minimal_gate_plan":{"constraint":"Only strongly justified, low-noise, reversible controls are eligible.","deferred":[],"phase_1":[]},"mode_policy":{"collect_history_structure":false,"collect_remote_telemetry":false,"include_baseline_capabilities":false,"include_testability_gaps":false,"max_phase_1_items":3,"recommendation_scope":"strongly_justified_gates_only"},"operating_mode":"minimal-safe-ci","profiles":{"composition":{"candidate_checks":[],"common_failure_modes":[],"cost_noise_notes":[],"exclusions":[],"expected_capabilities":[],"profile_contract_version":"1.0.0","selected_profiles":[],"structural_invariants":[]},"matches":[]},"recommendations":{"baseline_capabilities":[],"observed_failures":[],"ranked":[],"structural_invariants":[]},"report_version":"1.0.0","repository":"example/contract-shape","repository_model":{"build_systems":[],"capabilities":[],"components":[],"config_files":[],"critical_execution_paths":[],"entry_points":[],"examples":[],"file_count":0,"frameworks":[],"generated_artifacts":[],"languages":[],"lockfiles":[],"manifests":[],"model_evidence":{"confidence":"low","rationale":"Contract example with no project-specific claim.","references":[],"state":"derived"},"model_version":"1.0.0","relationships":[],"release_paths":[],"repository_archetypes":[],"root":".","schemas":[],"test_suites":{"commands_observed_in_ci":[],"files":[],"negative_files":[]},"unresolved_evidence":[],"validators":[],"workflows":[]},"workflow_telemetry":{"average_duration_seconds":null,"covered_branches":[],"covered_events":[],"diagnostics":[],"evidence":{"rationale":"No workflow telemetry is embedded in the static example.","references":[],"state":"unavailable"},"recurring_failures":[],"runs":[],"status":"unavailable"}}
